{
  "schemaVersion": "1.0.0",
  "solutionVersion": "0.2.0",
  "functions": [
    {
      "id": "M365Gov_AiActivity",
      "resourceName": "M365Gov_AiActivity",
      "displayName": "M365 Governance AI Activity",
      "version": "0.2.0",
      "source": "src/functions/M365Gov_AiActivity.kql",
      "metadata": "src/functions/M365Gov_AiActivity.metadata.json",
      "sha256": "11b7110a89b599bf9bf50c7120a677f39fcf9019b8a2ced3c2a73f13276f5c4a",
      "controlOwner": "The source AI platform and its native governance service",
      "category": "M365 Copilot Governance",
      "functionAlias": "M365Gov_AiActivity",
      "functionParameters": "starttime:datetime = datetime(null), endtime:datetime = datetime(null)",
      "query": "let queryStartTime = iff(isnull(starttime), ago(14d), starttime);\nlet queryEndTime = iff(isnull(endtime), now(), endtime);\n_Im_AgentEvent(starttime=queryStartTime, endtime=queryEndTime)\n| project\n    TimeGenerated,\n    EventStartTime,\n    EventEndTime,\n    IngestionTime = ingestion_time(),\n    EventUid,\n    EventOriginalUid,\n    EventType,\n    EventOriginalType,\n    EventResult,\n    EventResultDetails,\n    ActorUsername,\n    ActorUserId,\n    ActingAppId,\n    ActingAppName,\n    SrcAgentId,\n    SrcAgentName,\n    TargetAgentId,\n    TargetAgentName,\n    PlatformTargetAgentId,\n    PlatformTargetAgentName,\n    ModelProviderName,\n    ModelName,\n    ToolId,\n    ToolName,\n    EventSessionId,\n    EventRequestId,\n    EventResponseId,\n    EventProduct,\n    EventVendor,\n    EventSchema,\n    EventSchemaVersion\n| extend\n    GovernanceFunction = \"M365Gov_AiActivity\",\n    AuthoritativeControlOwner = \"Source AI platform; Microsoft Sentinel ASIM provides normalization\",\n    NativePortalRoute = \"https://security.microsoft.com/\""
    },
    {
      "id": "M365Gov_AuthenticationEvents",
      "resourceName": "M365Gov_AuthenticationEvents",
      "displayName": "M365 Governance Authentication Events",
      "version": "0.2.0",
      "source": "src/functions/M365Gov_AuthenticationEvents.kql",
      "metadata": "src/functions/M365Gov_AuthenticationEvents.metadata.json",
      "sha256": "c7a0c97fc9cbb01fb4938bd6daabbd8caff8d2d1ef839571328ad535751ff44a",
      "controlOwner": "Microsoft Entra ID or the authentication source represented by ASIM",
      "category": "M365 Copilot Governance",
      "functionAlias": "M365Gov_AuthenticationEvents",
      "functionParameters": "starttime:datetime = datetime(null), endtime:datetime = datetime(null)",
      "query": "let queryStartTime = iff(isnull(starttime), ago(14d), starttime);\nlet queryEndTime = iff(isnull(endtime), now(), endtime);\n_Im_Authentication(starttime=queryStartTime, endtime=queryEndTime)\n| project\n    TimeGenerated,\n    EventStartTime,\n    EventEndTime,\n    IngestionTime = ingestion_time(),\n    EventUid,\n    EventType,\n    EventResult,\n    EventResultDetails,\n    EventOriginalResultDetails,\n    ActorUsername,\n    ActorUserId,\n    TargetUsername,\n    TargetUserId,\n    SrcIpAddr,\n    SrcGeoCountry,\n    TargetAppName,\n    TargetAppId,\n    LogonMethod,\n    EventProduct,\n    EventVendor,\n    EventSchema,\n    EventSchemaVersion\n| extend\n    GovernanceFunction = \"M365Gov_AuthenticationEvents\",\n    AuthoritativeControlOwner = \"Microsoft Entra ID and the source authentication provider\",\n    NativePortalRoute = \"https://entra.microsoft.com/#view/Microsoft_AAD_UsersAndTenants/UserManagementMenuBlade/~/SignIns\""
    },
    {
      "id": "M365Gov_DataHealth",
      "resourceName": "M365Gov_DataHealth",
      "displayName": "M365 Governance Data Health",
      "version": "0.2.0",
      "source": "src/functions/M365Gov_DataHealth.kql",
      "metadata": "src/functions/M365Gov_DataHealth.metadata.json",
      "sha256": "ddaebb4996f2c75bc1e76ed64f773cd48ba8dc4e70c7cfebd198b984f7f2eed4",
      "controlOwner": "Each source product owns its telemetry; Microsoft Sentinel owns workspace ingestion health",
      "category": "M365 Copilot Governance",
      "functionAlias": "M365Gov_DataHealth",
      "functionParameters": "lookback:timespan = 24h",
      "query": "let healthWindow = iff(isnull(lookback), 24h, lookback);\nlet expected = datatable(\n    TableName:string,\n    AuthoritativeControlOwner:string,\n    NativePortalRoute:string,\n    RequiredForMvp:bool,\n    ExpectedFreshness:timespan\n)\n[\n    \"CopilotActivity\", \"Microsoft Purview Audit / Microsoft 365 audit\", \"https://purview.microsoft.com/audit\", true, 6h,\n    \"SecurityAlert\", \"Originating Microsoft Defender, Entra, or Purview alert provider\", \"https://security.microsoft.com/alerts\", true, 2h,\n    \"SecurityIncident\", \"Microsoft Sentinel investigation container\", \"https://portal.azure.com/#view/Microsoft_Azure_Security_Insights/WorkspaceSelectorBlade\", true, 2h,\n    \"SigninLogs\", \"Microsoft Entra ID\", \"https://entra.microsoft.com/#view/Microsoft_AAD_UsersAndTenants/UserManagementMenuBlade/~/SignIns\", true, 2h,\n    \"AADNonInteractiveUserSignInLogs\", \"Microsoft Entra ID\", \"https://entra.microsoft.com/#view/Microsoft_AAD_UsersAndTenants/UserManagementMenuBlade/~/SignIns\", false, 2h,\n    \"AuditLogs\", \"Microsoft Entra ID\", \"https://entra.microsoft.com/#view/Microsoft_AAD_IAM/ActiveDirectoryMenuBlade/~/Audit\", true, 4h,\n    \"IdentityInfo\", \"Microsoft Defender XDR\", \"https://security.microsoft.com/\", false, 24h,\n    \"CloudAppEvents\", \"Microsoft Defender for Cloud Apps\", \"https://security.microsoft.com/cloudapps\", false, 4h,\n    \"AlertInfo\", \"Microsoft Defender XDR\", \"https://security.microsoft.com/alerts\", false, 2h,\n    \"AlertEvidence\", \"Microsoft Defender XDR\", \"https://security.microsoft.com/alerts\", false, 2h,\n    \"DeviceEvents\", \"Microsoft Defender for Endpoint\", \"https://security.microsoft.com/advanced-hunting\", false, 4h,\n    \"IdentityLogonEvents\", \"Microsoft Defender for Identity / Defender XDR\", \"https://security.microsoft.com/advanced-hunting\", false, 4h,\n    \"IdentityDirectoryEvents\", \"Microsoft Defender for Identity / Defender XDR\", \"https://security.microsoft.com/advanced-hunting\", false, 4h,\n    \"IdentityQueryEvents\", \"Microsoft Defender for Identity / Defender XDR\", \"https://security.microsoft.com/advanced-hunting\", false, 4h,\n    \"MicrosoftPurviewInformationProtection\", \"Microsoft Purview Information Protection\", \"https://purview.microsoft.com/\", false, 24h,\n    \"OfficeActivity\", \"Microsoft Purview Audit / Microsoft 365 workloads\", \"https://purview.microsoft.com/audit\", true, 6h,\n    \"EnrichedMicrosoft365AuditLogs\", \"Microsoft Purview Audit\", \"https://purview.microsoft.com/audit\", false, 6h,\n    \"NetworkAccessGenerativeAIInsights\", \"Microsoft Entra Global Secure Access (preview)\", \"https://entra.microsoft.com/\", false, 6h\n];\nlet observed =\n    union isfuzzy=true\n    (CopilotActivity | where TimeGenerated > ago(healthWindow) | project TableName=\"CopilotActivity\", TimeGenerated),\n    (SecurityAlert | where TimeGenerated > ago(healthWindow) | project TableName=\"SecurityAlert\", TimeGenerated),\n    (SecurityIncident | where TimeGenerated > ago(healthWindow) | project TableName=\"SecurityIncident\", TimeGenerated),\n    (SigninLogs | where TimeGenerated > ago(healthWindow) | project TableName=\"SigninLogs\", TimeGenerated),\n    (AADNonInteractiveUserSignInLogs | where TimeGenerated > ago(healthWindow) | project TableName=\"AADNonInteractiveUserSignInLogs\", TimeGenerated),\n    (AuditLogs | where TimeGenerated > ago(healthWindow) | project TableName=\"AuditLogs\", TimeGenerated),\n    (IdentityInfo | where TimeGenerated > ago(healthWindow) | project TableName=\"IdentityInfo\", TimeGenerated),\n    (CloudAppEvents | where TimeGenerated > ago(healthWindow) | project TableName=\"CloudAppEvents\", TimeGenerated),\n    (AlertInfo | where TimeGenerated > ago(healthWindow) | project TableName=\"AlertInfo\", TimeGenerated),\n    (AlertEvidence | where TimeGenerated > ago(healthWindow) | project TableName=\"AlertEvidence\", TimeGenerated),\n    (DeviceEvents | where TimeGenerated > ago(healthWindow) | project TableName=\"DeviceEvents\", TimeGenerated),\n    (IdentityLogonEvents | where TimeGenerated > ago(healthWindow) | project TableName=\"IdentityLogonEvents\", TimeGenerated),\n    (IdentityDirectoryEvents | where TimeGenerated > ago(healthWindow) | project TableName=\"IdentityDirectoryEvents\", TimeGenerated),\n    (IdentityQueryEvents | where TimeGenerated > ago(healthWindow) | project TableName=\"IdentityQueryEvents\", TimeGenerated),\n    (MicrosoftPurviewInformationProtection | where TimeGenerated > ago(healthWindow) | project TableName=\"MicrosoftPurviewInformationProtection\", TimeGenerated),\n    (OfficeActivity | where TimeGenerated > ago(healthWindow) | project TableName=\"OfficeActivity\", TimeGenerated),\n    (EnrichedMicrosoft365AuditLogs | where TimeGenerated > ago(healthWindow) | project TableName=\"EnrichedMicrosoft365AuditLogs\", TimeGenerated),\n    (NetworkAccessGenerativeAIInsights | where TimeGenerated > ago(healthWindow) | project TableName=\"NetworkAccessGenerativeAIInsights\", TimeGenerated),\n    (datatable(TableName:string, TimeGenerated:datetime)[])\n    | summarize LastEventTime=max(TimeGenerated), EventCount=count() by TableName;\nexpected\n| join kind=leftouter observed on TableName\n| extend Age = now() - LastEventTime\n| extend Status = case(\n        isnull(LastEventTime), \"UnavailableOrSilent\",\n        Age > ExpectedFreshness, \"Stale\",\n        \"Healthy\")\n| extend GovernanceFunction = \"M365Gov_DataHealth\"\n| project-away TableName1"
    },
    {
      "id": "M365Gov_NativeAlerts",
      "resourceName": "M365Gov_NativeAlerts",
      "displayName": "M365 Governance Native Alerts",
      "version": "0.2.0",
      "source": "src/functions/M365Gov_NativeAlerts.kql",
      "metadata": "src/functions/M365Gov_NativeAlerts.metadata.json",